polis_rank,bridging_rank,approval_rate,polis_score,bridging_score,comment
188,182,56.2%,0.14545454545454545,0.0002508998625541241,LB should not be lending tools or equipment to individuals.
189,36,74.8%,0.14516129032258066,0.08068404893944632,The Land Bank should be ever-evolving in its role in our community.
190,76,61.9%,0.14428767354913863,0.03400393234964217,The Land Bank should not remove water from natural systems for agricultural
191,53,61.1%,0.14086964723637047,0.06167825431690623,The Land Bank should be more about natural resource protection than recreation or farming.
192,102,45.0%,0.1370429440604879,0.01632743634973123,The Land Bank should discontinue all commercial uses on their preserves.
193,172,43.8%,0.13043478260869565,0.0006855830174507913,The Land Bank has become a somewhat overstuffed and over comfortable organization that has strayed from its core mission of protecting land.
194,22,85.2%,0.12894766845285602,0.11757920882489048,"The Land Bank is critical to saving the last, best places in the islands when they come up for sale through acquisition"
205,240,100.0%,0.12500000000000003,0.0,A big part of what attracted us to Lopez Island is all the public land.  Love Stonecrest Farm and would like to see more actions like it.
205,240,100.0%,0.12500000000000003,0.0,The Land Bank needs to take better care of its' farm land.  Some farmers are doing a good job but others don't seem to care.
205,240,100.0%,0.12500000000000003,0.0,"I think the county could add up the costs/benefits, tangible and intangible, of tourism in the San Juan islands and keep track of it."
205,240,100.0%,0.12500000000000003,0.0,"Oprah, Bill Gates and Inslee should be forced to donate their land!"
205,240,100.0%,0.12500000000000003,0.0,Stand alone idea
205,240,100.0%,0.12500000000000003,0.0,Are there questions???
205,240,100.0%,0.12500000000000003,0.0,It is relevant to know about how much time annually one lives here.   It seems to reflect community engagement more than residency.
205,240,100.0%,0.12500000000000003,0.0,It is possible for humans for humans to live harmoniously — even beneficially — with nature
205,240,100.0%,0.12500000000000003,0.0,An intimate relationship with the land is crucial for both human & ecological well-being
205,240,100.0%,0.12500000000000003,0.0,Seek indigenous leadership to decolonize land management practices.
205,240,100.0%,0.12500000000000003,0.0,supported by research/data
205,240,100.0%,0.12500000000000003,0.0,clear and concise
205,240,100.0%,0.12500000000000003,0.0,Test
205,295,0.0%,0.12500000000000003,nan,The Land Bank contributes to the affordable housing problem by reducing development rights in the County.
205,297,0.0%,0.12500000000000003,nan,Water resource protection currently receives adequate attention by the Land Bank
205,296,0.0%,0.12500000000000003,nan,The Land Bank makes property living in the San Juans more expensive because it takes properties off of the tax rolls.
205,240,100.0%,0.12500000000000003,0.0,"Raise new perspectives,experiences & issues."
205,240,100.0%,0.12500000000000003,0.0,"I agree completely. Because we are talking about public funding, everything should be transparent."
205,240,100.0%,0.12500000000000003,0.0,"The LB should work with a community land trust to explore naturally-built, low impact, self-sustaining eco-villages on appropriate parcels"
205,240,100.0%,0.12500000000000003,0.0,"People want to protect what they love, but they can’t love it if they don’t know it"
205,174,70.6%,0.12500000000000003,0.0005161723096438669,Larger scale thinning projects should be pursued to enhance and protect the remnant old growth forests within LB preserves.
205,294,0.0%,0.12500000000000003,nan,The Land Bank helps slow down rampant development in the islands.
217,27,86.6%,0.12199492814877426,0.10005134152919515,The Land Bank is critical to maintaining quality of life in the islands
218,66,59.6%,0.11739826245999084,0.041558903005479736,The Land Bank should focus on increasing public beach access.
219,101,42.5%,0.11734364925854288,0.016954231889780652,The Land Bank Director should be an elected position.
220,108,42.5%,0.11601176156107991,0.01313431404883568,"To free up Land Bank staff and financial resources, some small holdings should be transferred to adjacent to state and federal landowners."
221,17,88.0%,0.11457381090888945,0.12963391880334352,The Land Bank is an important key to retaining the 'magic' of the islands
222,147,62.5%,0.111317254174397,0.0028266531882961588,"Agriculture has taken on an out-sized role in Land Bank operations, detracting from more essential and valuable efforts."
223,96,45.4%,0.10837019018133572,0.020812331714000425,The Land Bank has lost sight of it original mission and become a fiefdom lacking transparency and accountability.
224,110,41.7%,0.1061007957559682,0.012559298777129625,"Agriculture is a leading contributor to climate change, and should not be subsidized by the Land Bank."
225,114,62.0%,0.10283435408061531,0.01113179973199945,Buying accessible beachfront property for public access should be a higher priority for the Land Bank.
226,89,68.2%,0.10078651685393258,0.024432599342228557,Land Bank Ag preserves should prioritize food crops for islanders - not grass for cattle grazing with its high environmental footprint
227,19,84.3%,0.09856070087609511,0.12795375827022556,The Land Bank is necessary to help slow down rampant development in the islands.
228,104,40.0%,0.09191900622422988,0.014649975758200946,It does not fall within the mandate of the Land Bank to oversea agricultural use.
229,152,54.0%,0.08943687891056311,0.00235970758300248,The Land Bank focus on agriculture is detracting from other more valuable and important missions.
230,125,44.7%,0.08934169278996867,0.00696907922806756,Landbank commissioners act like board members of a for-profit land management company
231,11,85.9%,0.08928500693206576,0.14015811666488967,Renewing the Land Bank is important to the future of San Juan County.
232,41,47.9%,0.0891861761426979,0.07592417495954269,I live on San Juan.
233,179,45.5%,0.08888888888888888,0.0003017844786642528,Additional multi use trails should be built to accommodate growing need for trails tailored to specific user groups. ie bikes or horses.
234,139,81.0%,0.0838744588744589,0.0032917442247829385,The land bank should purchase more land for conservation
235,121,37.2%,0.08172329558072394,0.0073108292748228125,Multi-use recreational access should be available on more Land Bank properties
236,117,41.3%,0.08045659578385345,0.009659417872414502,The Land Bank should not purchase waterfront properties or defunct gas stations when there is so much farm and forest land yet to protect.
237,98,35.6%,0.08014809329877826,0.019889309125583,All Land Bank properties should be open to the public.
238,93,31.6%,0.07914797388481598,0.021883059376722577,"Every purchase of property and every restrictive easement by the Land Bank reduces the available property in the islands, increasing prices."
239,120,64.1%,0.07431525241675616,0.007813198402600518,The Land Bank's ability to actively manage its lands is limited by the size of its staff and its budget.
240,85,62.0%,0.07401042561723092,0.02706416589407621,"Land Bank should aquire more forest land and manage it for fire safety, ecological health and a yield of useful products."
241,136,43.3%,0.072972972972973,0.00388704136574689,"The Land Bank has acquired and divested water rights critical to local ,food production, on some of best farmland in the islands."
242,164,43.6%,0.07058823529411763,0.0011200332447943817,There are not enough Land Bank stewards on Orcas and Lopez to maintain and care for the properties adequately.
243,35,76.7%,0.06968376000634066,0.0840240925582759,"Although imperfect, the Land Bank remains steady, relevant and responsive in the complex task of providing conservation and public access."
244,82,75.5%,0.06656771799628942,0.02992853762283205,The Land Bank has been key to restoring rare species in the islands
245,163,41.9%,0.0642857142857143,0.0011291459665349192,The Land Bank often serves as an ally to high income property owners looking to minimize their taxes and/or ensure privacy.
246,129,38.1%,0.06196380588559035,0.006153990676352632,LB should offer small allotments to families for growing their own food.
247,157,54.8%,0.059833795013850416,0.0015531670854737325,"Resource extraction activities such as farming, logging, and mining should be prohibited on land bank properties."
248,240,20.0%,0.055555555555555566,0.0,Agriculture is destructive and should be limited on SJC Land Bank owned properties.
249,65,36.8%,0.055391976444608026,0.04202577757348016,I live on Orcas.
250,107,36.7%,0.05464285714285714,0.013315000936547952,The Land Bank is gorging itself on new property  without taking the time and money needed to take care of the property it already has.
251,165,64.3%,0.05378151260504202,0.0009526402395822512,The Land Bank has suffered due to irrational attacks from large volume property owners adjacent to Land Bank holdings.
252,123,30.3%,0.0526086956521739,0.007200574633874347,Leasing of agricultural land undermines appropriate oversight of Land Bank holdings.
253,183,34.8%,0.05000000000000001,0.00022450995754054183,The Land Bank’s mandate should be simplified with increased focus on local food production for climate change resilience.
254,40,73.5%,0.046595580678314485,0.07900230584603136,The Land Bank should lease farmland to local farmers.
255,54,72.0%,0.046312869160551294,0.05953226682336536,The Land Bank's current mandate provides a good balance of benefits to the people of San Juan County.
256,75,31.7%,0.043945953036862134,0.03467455392804158,I attend Land Bank meetings.
257,68,62.6%,0.042935621882990306,0.03874969359784787,The Land Bank plays an important role in promoting historic preservation in the county.
258,149,46.8%,0.04092071611253198,0.0025472103574297926,There is no true wilderness remaining in the islands. Ensuring public recreational access should be Land Bank's primary mission.
259,126,35.2%,0.036057692307692304,0.006886549697183066,The Land Bank's mandate should be revised.
260,131,28.9%,0.035714285714285705,0.006010299063492966,"The Land Bank does not treat adjacent property owners with common sense, human decency and respect."
261,184,25.0%,0.03333333333333335,0.00016633739764755062,"Given the local focus of the Land Bank, climate change should not demand significant staff time or other Land Bank resources."
262,132,30.1%,0.03215051202667301,0.005142743414453407,"The Land Bank says ""jump"" and the County Comission says ""how high""."
263,159,29.7%,0.029088558500323197,0.0013344120789177266,I think the LB should focus more on opening preserves and buying new ones for the purposes of multi-use recreation such as mountain biking.
264,119,23.6%,0.028571428571428564,0.008336841635793481,The Land Bank should not be growing native plants for habitat restoration and for sales to the public.
265,77,42.2%,0.02754990925589837,0.0328373710472656,Hunting should be permitted on more Land Bank properties.
266,111,50.4%,0.0255446308077887,0.011692932280255702,More people and pets are using preserves. Dog presence can negatively impact wildlife.  Can more preserves be restricted from dog access?
267,161,32.7%,0.02526315789473683,0.001194683473832163,The Land Bank should make some timberlands available for carefully managed personal use firewood harvest by island residents.
268,176,25.0%,0.024242424242424232,0.000453482722764911,Equestrian use of the land has historical background and we should be allowed to use it especially by local neighbors
269,84,46.4%,0.024241756858796877,0.029218924500114554,The Land Bank should prioritize preservation of working farmland.
270,240,0.0%,0.023809523809523808,0.0,The Land Bank should contribute to reducing farming in the islands.
271,167,26.2%,0.023068050749711647,0.0009282658989397356,Land Bank's renewal passed by only 429 votes last time. How about lowering it to .5 percent next time it comes up for renewal?
272,186,20.7%,0.02272727272727273,0.00012041045768873612,If you have already paid the LB tax you should receive offsetting credit if you buy and move in to a different SJ County home.
273,72,66.9%,0.02172293644118706,0.03742213042065948,"The Land Bank is a small, efficiently run organization that manages a significant workload."
274,127,27.7%,0.01757518796992481,0.00668095795128718,"We have huge Federal Parks in addition to large acreage, big and small, under land bank control, really already more than it can manage."
275,122,36.1%,0.015236602672935438,0.007293972223024846,Expanding and connecting existing preserves should be a higher priority than creating new preserves.
276,141,17.8%,0.014894378804153244,0.0030487674891082352,The Land Bank should sell Coffelt Farm Preserve and its other farmed properties.
277,185,36.4%,0.01428571428571428,0.00015551221848183122,The Land Bank Tax at 1% should be made permanent.
278,140,30.2%,0.013282732447817837,0.0032566872671748,The Land Bank should do more work on the islands not served by ferries.
279,81,61.7%,0.012857142857142857,0.0308134887724285,The Land Bank staff and commissioners are approachable and responsive.
280,113,51.2%,0.012208181623473981,0.011360227973973394,"The Land Bank tax should be increased to 1.5 %, made permanent, and not renewable by voters to protect us from development pressure."
281,133,33.3%,0.009916610322289835,0.004575456932891241,Water resource protection currently receives adequate attention by the Land Bank.
282,187,18.8%,0.008888888888888889,0.00010151127150473659,"The Land Bank has done little to serve the jurisdiction of Friday Harbor, despite many opportunities to do so."
283,153,18.7%,0.007342995169082132,0.0022134567917913308,Land Bank acquisitions and restrictive easements have reduced local food resilience.
284,97,25.6%,0.007020007020007018,0.020521615038924343,I volunteer with the Land Bank.
285,158,41.8%,0.006845238095238088,0.0013429110286741247,The Land Bank is about the most useful organization in  San Juan County
286,146,14.4%,0.006829268292682931,0.0028474476819413137,The Land Bank spends too much on ecological enhancement and restoration.
287,106,29.5%,0.005565638233514822,0.013730749728392402,We should incorporate affordable housing on some Land Bank properties.
288,118,18.3%,0.0049560414936665464,0.009575624429082882,I live on Lopez.
289,150,15.9%,0.004452690166975881,0.002519749123384222,The Land Bank should rely more heavily on contractors to manage its preserves.
290,137,14.1%,0.0035607877334496033,0.0033836145050495318,"Similar to their leased agriculture lands, the Land Bank would benefit financially by leasing their forest lands to private forest companies."
291,173,10.4%,0.00242456896551724,0.0006060428775632932,The Land Bank should focus on buying land for federal and state managers
292,151,13.0%,0.002072002072002073,0.0024402994993164505,The Land Bank has done enough conservation.
293,73,61.1%,0.0015588942897824915,0.037382161565684566,The Land Bank listens to the communities it serves.
294,87,61.1%,0.0009533225054727777,0.02601274288064175,The Land Bank does an excellent job of managing its properties
295,171,9.5%,0.000573394495412844,0.0006889131488579284,The Land Bank seeks to eliminate all agriculture in the County.
296,180,6.7%,0.00026402640264026385,0.00028892520652709836,The Land Bank seeks to eliminate all future residential development in the County.
297,178,3.2%,0.00015180649731808525,0.00035451048685926335,I live on Shaw.
