polis_rank,bridging_rank,approval_rate,polis_score,bridging_score,comment
1,6,97.6%,0.861111111111111,0.17806720161109307,"The Brexit vote wasn't really about the EU, but was rather a proxy vote on various issues. Unfortunately they weren't all the same issues."
2,1,97.5%,0.8497298015591779,0.30444349446235003,The Northern Ireland/Republic of Ireland border is a huge issue that isn't being given enough attention.
3,4,95.3%,0.8130081300813008,0.24857309361265617,The idea of sovereignty is badly defined. What does it matter if we gain the theoretical freedom from European institutions if we end up practically constrained by those institutions in any event?
4,3,94.9%,0.8103695641418889,0.2703436226085511,"A free trade deal with the USA will be more restrictive and onerous than any EU arrangement, especially if negotiated under a Trump presidency."
5,2,96.3%,0.797543135783946,0.2933857733905045,I voted to Remain.
6,24,98.1%,0.7938294010889292,0.02728976218410138,The varied nature of EU institutions means everyone likes some parts of it and hates other parts (whether they know it or not).
7,19,96.6%,0.7542857142857142,0.032347406371231055,"""The EU"" as a concept is too big and too varied to be summed up simply, which is why an ""in/out"" vote was a stupid idea in the first place."
8,29,97.4%,0.7234615384615385,0.013476086574644178,A binary out/in vote where an ill-defined wishlist of lies & fantasies ran against a real flawed product of compromise was an awful idea
9,22,94.4%,0.7071307300509337,0.028137215180357087,The current Brexit negotiating team are woefully inadequate for the task in every aspect. Replacing them should be a priority.
10,27,94.0%,0.6666666666666666,0.022426355394814326,"Because of the way the referendum demographics broke down, both parties are in real danger that a political misstep could ruin them."
11,8,89.2%,0.6440251572327044,0.09407204926273477,"The EU referendum has split the electorate in ways that traditional party lines cannot capture, and we haven't yet worked out how to react as a nation."
12,32,94.1%,0.6380236305048334,0.010223378075274627,The referendum result produced no clear objectives for the Brexit negotiations. No options should be ruled out at this stage.
13,5,92.3%,0.6331606455162295,0.19483986082259697,The Single Market is important for the prosperity of the country.
14,33,94.4%,0.6293706293706294,0.010160523942879671,"EU may be unreformable, but principles of solidarity btw nations, FoM, common workers rights are so important we should try to salvage it"
15,36,92.9%,0.6111111111111112,0.006780112045796149,Labour's manifesto position allows them the freedom to reject any Brexit deal which could harm jobs in the UK
16,31,91.9%,0.5954415954415955,0.010648452653318098,"Tories don't care whether Brexit will be harmful as they believe there will be plenty of others to blame (eg. EU, Immigrants, Remainers)"
17,30,84.4%,0.5308333333333333,0.012709583255763565,"Opposition to Brexit as a whole won't stop it, but opposition to the component parts of it just might."
18,34,86.8%,0.48,0.009712406242510132,"Brexit was two projects in one - ""UK FTZ plc"" and ""let's make racism the core issue in British politics""."
19,9,82.9%,0.4619805481874447,0.09235575596234592,A referendum should not be binding for a decision of this magnitude.
20,14,79.1%,0.43333333333333335,0.048824031485937364,There should be a referendum on the final deal between the UK and the EU
21,43,85.7%,0.384,0.001264253032636889,"Labour may not be able to make substantive promises to Remainers, but it's harmful that they have no message for Remainers at all."
22,13,68.0%,0.3061224489795918,0.0534406869004352,Other issues are more important to me than Brexit
23,16,65.3%,0.2633101851851852,0.042794659495376475,"I am opposed to the neoliberal economics the EU stands for, but voted to remain as I did not trust the Tories to administer Brexit."
24,46,71.4%,0.2539682539682539,0.00016714120959893962,"Pressure against Brexit should be directed at the Conservative Party, who have the (slight) majority in the Commons, not Labour."
25,38,66.7%,0.22916666666666669,0.003388647214532892,"Labour can (still) stop Brexit - but through delaying tactics, not outright opposition."
26,35,70.7%,0.2037037037037037,0.007837306803500374,'Lexit' is just the stupidest fucking thing imaginable
27,42,57.1%,0.19999999999999998,0.002292086613893671,"Lexit is utopian, but so is the case for workers' unity within the EU; the EU is still a capitalist club."
28,12,56.2%,0.1970029239766082,0.06381434690810378,Labour should listen to the genuine concerns of leave voters and not just try to override a referendum because they don't like the results.
29,18,59.6%,0.1590909090909091,0.03767463207008109,"Whatever happens, the UK is better off out of the Euro."
30,20,64.3%,0.1443001443001443,0.03228862051115023,There should not be a second referendum on the original question
31,10,57.2%,0.12295516376355863,0.08268082738245207,I can speak a European language.
32,25,56.0%,0.121580547112462,0.026614637199194668,"A Pro-EU centrist party could have done better, but the Lib Dems were poisoned by their association with Tory Austerity."
33,37,35.6%,0.08220679576178296,0.005911867713653812,There is nothing left wing about the EU
34,7,74.2%,0.07835811324948913,0.13711014991659776,I consider myself middle class.
35,15,41.1%,0.07751211126738553,0.043206860119817884,"Brexit could be a success, but not let by this incompetent Tory party."
36,41,42.9%,0.06837606837606838,0.0025341079135113736,A second referendum would be pointless as it would be run on the same lines as the first and majority of people will be no better informed.
37,39,38.8%,0.06666666666666667,0.0028756311283136505,"There's no point ""opposing Brexit"" at this stage. It's a rock rolling down a hill, the inertia is too great for it to be stopped."
38,17,42.6%,0.04662004662004662,0.04032219945189024,Labour was right to support the article 50 vote.
39,11,63.2%,0.03883357041251778,0.06881540751110668,Labour should oppose the Brexit process.
40,21,38.0%,0.030303030303030318,0.029820076588170343,"Freedom of Movement is an issue that personally affects me or someone close to me - it could lead to me having to leave the country, or to future difficulties in seeing my family."
41,26,30.8%,0.017277235642297224,0.02564116369514901,I consider myself working class.
42,28,27.0%,0.013541666666666672,0.014670231851036185,I think we should support the referendum result.
43,23,38.8%,0.012799999999999997,0.027778302164498316,"There is some difference between Labour and the Tories on Brexit, but on the fundamentals they're still so similar as to make no practical difference."
44,44,13.3%,0.0021265284423179153,0.0006300104905650663,The EU is institutionally against workers rights
45,40,13.2%,0.0006623093681917207,0.002631042024357553,There's literally no difference between Labour and the Tories on Brexit.
46,48,3.1%,0.00020354162426216137,0.00012759515570934257,The Conservatives are the only party dedicated to making a success of Brexit.
47,45,2.5%,9.434407283362431e-05,0.00018979872297158294,I've changed my mind about my vote since the referendum.
48,49,1.1%,7.754342431761793e-05,0.0,Brexit will be a success as long as we all stay firm against the EU and don't let the government negotiate our sovereign rights and freedoms away.
49,49,1.0%,6.449948400412793e-05,0.0,"The UK's borders are basically unprotected, thanks to the EU."
50,47,1.8%,4.45632798573975e-05,0.00013281604977106708,I voted to Leave.
