polis_rank,bridging_rank,approval_rate,polis_score,bridging_score,comment
1,9,99.0%,0.8938640132669983,0.14557525153086817,The Land Bank should operate with transparency.
2,2,92.8%,0.8328508700601724,0.350108252644926,My primary residence is in the San Juan Islands.
3,1,92.9%,0.8084829838517287,0.35279240371792736,I’m registered to vote in San Juan County.
4,105,96.7%,0.7336589030803907,0.013771377121139976,Thoughtfully structured access to Land Bank lands is compatible with preserving the natural habitat.
5,3,88.2%,0.7285737518295659,0.31872546330210333,I own real-estate in the San Juan Islands.
6,115,93.0%,0.6857366771159875,0.010933032885746747,The Land Bank would benefit from a visible and engaging leader who builds strong relationships with a wide variety of island groups.
7,4,95.1%,0.6779417526446387,0.186995899610546,The Land Bank should always take into consideration care/maintenance of wetlands and soils.
8,26,89.8%,0.6779259259259258,0.1010658754989279,The Land Bank should not use our tax dollars to subsidize trucked-in (non eco-friendly) fertilizers.
9,44,89.8%,0.6718750000000001,0.06883858475509556,The LB needs to consider soil health as the guiding principle of it's agricultural lands.
10,6,94.6%,0.6687726260094682,0.15456565870941877,It is important for the Land Bank to be responsive to community ideas.
11,49,82.7%,0.6558335281739537,0.0662508297202459,There should be term limits for Land Bank Commissioners.
12,55,93.4%,0.6519274376417235,0.05754108175743644,The Land Bank should work actively with community trails organizations to enhance the county's trail network and appropriate public access.
13,154,96.2%,0.6222222222222222,0.002202717440502289,Hold meetings at times when a greater diversity of community members than is currently able to attend can participate.
14,7,94.7%,0.617353001188233,0.1535546667138429,"Preservation of land helps to guarantee that people, seven generations from now, will have open space and biodiversity"
15,10,92.1%,0.6002363089912129,0.14529961160186775,There is value in pure preservation not all land should be occupied by humans
16,15,88.1%,0.5550585324069668,0.13101001710318866,Mountain biking should remain only a minor component of Land Bank recreational opportunities.
17,18,92.0%,0.5533396644507754,0.12822142759677943,"Natural resource stewardship  should be central to all land bank property management, whether primarily in ag, recreation or habitat uses"
18,5,93.0%,0.5301942567567568,0.16119259325488094,Protecting land for native plants and animals should remain a key part of the Land Bank's mandate and work.
19,32,89.4%,0.48694104560622914,0.08919395706030042,Farmable soils and associated water must be protected and improved to mitigate climate change and provide for food security in the future.
20,38,87.4%,0.4821718931475029,0.079244825335707,Food miles matter.  Food from local island farms is a great way to reduce carbon emissions.
21,112,76.4%,0.47232142857142856,0.01150854714959066,Land Bank leadership should incorporate public opinion before taking any actions with public funds.
22,168,94.1%,0.46753246753246747,0.0008448943241688962,The Land Bank should pursue its stated mission of preserving cultural landscapes for all ancestral tribes equitably.
23,166,94.7%,0.46428571428571425,0.0009326024933907973,San Juan Island County needs data reported on projected development and how it may/will impact Land Bank areas.
24,12,90.1%,0.46211687878354546,0.13792399969602231,Allowing local students access to Land Bank properties is important.
25,33,85.4%,0.4595959595959596,0.08766316726730047,We need to strike a balance between conservation and sustainable agricultural practices.
26,43,88.0%,0.45253759398496246,0.07242560797850783,The Land Bank should put more effort into protecting water resources.
27,50,86.8%,0.44716466131907306,0.06378459712201826,The Land Bank needs to maintain water rights and long term agricultural viability of it's agricultural lands.
28,8,89.3%,0.4463552903255705,0.15083621562880892,Preserves and trails benefit everyone.
29,14,90.8%,0.4396164021164021,0.13490810494430688,The Land Bank is important in preserving climate resiliency.
30,23,88.5%,0.4331078131820166,0.1123397337590461,There is too much development happening in the islands
31,21,91.0%,0.4308895405669599,0.12075049346916396,"Land Bank Preserves offer peace and solitude, especially for people living in smaller neighborhoods."
32,60,93.1%,0.4206458174421561,0.048091962309468314,"The Land Bank, by preserving properties and easements, helps to mitigate the effects of ""build out""  in the county."
33,83,80.7%,0.4158834586466165,0.02958055110817085,Do not transfer of small holdings to state or federal ownership if it abrogates the original mission.
34,169,93.8%,0.4153846153846154,0.0007043913680824921,Meadow restoration work is critical and most projects have been successful in restoring endangered habitats.
35,181,100.0%,0.39999999999999997,0.00027926039169063916,Land Bank needs to be true to original mission
36,24,79.7%,0.3879310344827586,0.11075898015636719,Agriculture on Land Bank properties should be done with extreme caution due to the inherent confilct between short-term profit and resource damage.
37,52,79.0%,0.38711374095989476,0.06234738900241678,The Land Bank should do more to control invasive weeds that threaten native plant communities.
38,160,81.8%,0.38499999999999995,0.001214069371790736,Landbank should manage lands for local food production to reduce emissions and create resiliency
39,29,83.8%,0.3786057692307693,0.09844732889095975,Teaching youth about the ecology of landbank owned properties should be a priority.
40,71,74.6%,0.37451171875,0.03781258926288754,The Land Bank Commission needs more diverse representation.
41,16,91.5%,0.3714039621016365,0.13028530940347716,The Land Bank helps improve the health of the Salish Sea by protecting natural features along shorelines.
42,64,84.2%,0.36111111111111105,0.04215494309738272,Some LB forests should be actively managed to change the trajectory towards historic habitats such as old growth forests and oak savannahs.
43,56,82.9%,0.3559633027522936,0.05349165242199978,The Land Bank should actively manage it's most at risk forests to reduce wildfire risk.
44,25,88.3%,0.3421945701357466,0.10747460583045793,"The Land Bank seeks to maintain the health and well-being of island ecosystems and the plants, animals and people who depend upon them."
45,48,78.9%,0.33277226459044645,0.06689549993423137,It's a good idea for the Land Bank to restore some farmed areas to native habitat.
46,100,86.9%,0.3232062055591467,0.018003461941519576,Water availability is increasingly critical in the county.  LB should have a voice in helping to protect our aquifers from development.
47,34,86.3%,0.3218459100812042,0.08727197604186615,Streamside forest buffers should be protected or planted on every Land Bank Preserve with a stream.
48,28,85.4%,0.3197115384615385,0.09879498489764496,Preserving working farmland for food production is important for the resiliency of island communities.
49,88,79.5%,0.31249999999999994,0.025278090282492203,Coffelt Farm preserve is a great place to educate and demonstrate climate mitigating practices for our community.
50,69,66.7%,0.30966918572644014,0.0386726047774962,Prervation of farmland should not include cheap leases for grazing
51,175,75.0%,0.3085714285714285,0.0004651541945369996,The land bank should provide land for indigenous management and cultural practice
52,162,61.3%,0.3068181818181818,0.0011732190503663845,"The Land Bank’s litigious nature must be examined as well as expenditure line items for graphics design, branding, need a more frugal budget"
53,62,72.5%,0.30006010819475054,0.044005986797892055,"The Land Bank needs an organic, sustainable, or regenerative farmer on the Commission."
54,142,65.2%,0.29206730769230765,0.0029862740218304096,The vast majority of Land Bank managed properties are unknown and/or inaccessible to the vast majority of island residents.
55,45,72.5%,0.2895377128953771,0.06881379986155721,The public does not know about natural resources and often advocates for short-term human uses that lead to degradation of the earth
56,144,91.2%,0.2888888888888889,0.002914707988275821,I am grateful for the Land Bank.
57,116,80.0%,0.2842664092664093,0.010037585019170575,I also think the land bank should prioritize one or two strategic coastal acquisitions on orcas to open up more beaches to the public.
58,31,78.7%,0.28130097539864846,0.0906828385345922,"Land Bank should re-wild agricultural land that have encroached on wetlands, streams, or other critical watershed lands."
59,47,61.1%,0.27893797411869703,0.06712129324068404,Stewardship of natural resources is separate from developing properties for human use like recreation and agriculture.
60,70,72.4%,0.2782258064516129,0.038264993944079735,The Land Bank needs Indigenous representation on the Commission.
61,74,55.8%,0.27118525757364226,0.036686563231767985,There is a lack of transparency in the Land Bank's decision process and some conflict of interest.
62,46,77.3%,0.26556531703590525,0.0681931508072489,Land preservation and cultural preservation should be balanced.
63,143,67.4%,0.2525252525252525,0.002957553785163227,The Land Bank is slow/resistant to make newly acquired property publicly accessible.
64,39,75.1%,0.2517162471395881,0.07922540178062852,The Land Bank should invest in upkeep and maintenance of infrastructure and soil health on agricultural preserves.
65,20,85.1%,0.2495608116709524,0.12623181756520885,The Land Bank needs to protect more land for habitat conservation.
66,103,71.4%,0.24727232852678324,0.015491357229584843,Land Bank's mandate should lean towards ecological restoration and management and away from agricultural management.
67,61,67.9%,0.23821022727272728,0.044354818146805246,The Land Bank should provide tours of the holdings.
68,177,61.1%,0.2380952380952381,0.00036147821947718397,The Land Bank office should be housed within the San Juan County office compound and convert the house they occupy to farmworker housing
69,109,67.8%,0.2370927318295739,0.01271735294722981,Lack of appropriate forest management practices have led to increased fire risk on the west coast and on some Land Bank properties.
70,130,68.3%,0.2309782608695652,0.006110934300397944,"All Land Bank properties and easements should include a clear plan for public access, including parking, trails, and other services."
71,170,70.0%,0.2285714285714285,0.0007036118254987035,"Coffelt farm preserve should be accessible to many islanders who want to farm, not just one for profit limited liability company"
72,37,80.6%,0.22778808493094208,0.07953641940957833,The Land Bank is unique in the nation and it demonstrates that this community wants a healthy environment.
73,134,79.1%,0.22736842105263155,0.004301871579693982,Access to Land Bank properties  should limited to low intensity activities like hiking.
74,79,62.2%,0.22588235294117645,0.03216763855501659,The Land Bank’s mandate should be simplified with increased focus on ecological protection and restoration for climate change resilience.
75,42,63.9%,0.22073161369568553,0.07517423872597356,The landbank should focus on open space and ecological health and leave  issues with affordable housing and farming to other entities
76,124,82.1%,0.22021456804065495,0.007017111317364802,"The Land Bank should conserve a min. of 35% of county land. We do not have water resources for increased development, even in UGAs."
77,86,52.7%,0.2171152518978606,0.026586555136859136,There should be a change of leadership at the Land Bank.
78,90,50.7%,0.21098626716604246,0.022158525507150563,The Land Bank does not have the appropriate knowledge/skill set to oversea agriculture/farm operations.
79,59,82.8%,0.20370370370370366,0.04923946756476417,The Land Bank’s unique value is its ability to fill the gap between land trust and parks provider.
80,63,59.3%,0.2022232142857143,0.04333883680303668,"Efforts to conserve agricultural land should emphasize flexibility, necessary infrastructure, and working agriculture over preservation of view corridors."
81,78,54.7%,0.1935960708580693,0.032734525678592814,The Land Bank should not rent and subsidize private/for-profit farmland.
82,155,66.7%,0.18939393939393936,0.0021378713507807312,The Land Bank suffers from poor leadership that does not share key information such as the actual cost of projects with the public
83,51,66.8%,0.18492887351018839,0.062422931377288354,"When planning future uses at a new Preserve, the Land Bank should prioritize habitat protection/conservation over public access."
84,67,59.8%,0.18487394957983197,0.03958333666204658,The Land Bank should not convert agricultural land to recreational uses.
85,13,91.1%,0.18406413612565448,0.136077840196556,We are lucky to have a Land Bank in the County.
86,145,63.6%,0.18398268398268397,0.0028997384061918868,The Land Bank Commissioners reflect a somewhat dated and one sided view of what the Land Banks is and should be.
87,57,62.1%,0.18102132713891583,0.05141453531086812,The Land Bank needs to open more trails.
88,156,63.2%,0.177717019822283,0.00191410295491635,Public Land Band meetings are often unprofessional
89,99,70.2%,0.1776239907727797,0.018833869226065857,Land Bank should co-manage important cultural sites with local tribes
90,80,65.7%,0.17218323586744638,0.030863381527284205,Ferry served islands have the most critical need for Land Bank preservation efforts
91,148,65.1%,0.1717171717171717,0.002637676113287562,"The Land Bank devotes excessive staff time to arbitrarily identified ""restoration"" projects, with no clear overall strategy or vision."
92,30,85.0%,0.17027243589743593,0.0981571733556816,The Land Bank plays a key role among agencies and nonprofit organizations in ‘big picture’ conservation planning in the islands.
136,240,100.0%,0.16666666666666669,0.0,All LB Board members should have 5 year term limits.
136,240,100.0%,0.16666666666666669,0.0,No agriculture on LB properties
136,240,100.0%,0.16666666666666669,0.0,The Land Bank should not play a role in advocating for or subsidizing agricultural enterprise.
136,240,100.0%,0.16666666666666669,0.0,The Land Bank lets those of us who can't own huge parcels of land enjoy the beauty of our home
136,240,100.0%,0.16666666666666669,0.0,Thank you for sponsoring this survey.
136,240,100.0%,0.16666666666666669,0.0,Land Band public meetings are too often unprofessional
136,240,100.0%,0.16666666666666669,0.0,LB commissioners and executive director should demonstrate more professionalism in public meetings
136,240,100.0%,0.16666666666666669,0.0,"Land Bank leaders would be wise to broaden outreach ahead of next vote, expanding their pool of support and allies."
136,240,100.0%,0.16666666666666669,0.0,"If I were fortunate enough to own property next to a Land Bank property, I would be overjoyed at having a public park as my neighbor."
136,240,100.0%,0.16666666666666669,0.0,The Land Bank has a critical role to play in building a network of trails across the islands.
136,240,100.0%,0.16666666666666669,0.0,Public access and recreational needs are a key part of Land Bank mission and should factor into acquisition and management plans.
136,240,100.0%,0.16666666666666669,0.0,The Land Bank is a critical ingredient to keeping the islands beautiful and comfortable for islanders.
136,240,100.0%,0.16666666666666669,0.0,"The Land Bank should further increase support for additional user groups: hunters, fishing, bikers, geo cache, etc."
136,240,100.0%,0.16666666666666669,0.0,?
136,240,100.0%,0.16666666666666669,0.0,Landbank: remember equestrian use of the land has historical background and we should be allowed to use it especially by local neighbors
136,240,100.0%,0.16666666666666669,0.0,more trails open Much land bank land is not open to the public & our own property purchases helped pay the land bank to buy their property
136,240,100.0%,0.16666666666666669,0.0,The Land Bank should include ag lands in it's acquisition policy but subsidizing farmers and farming should be the work of other agencies.
136,240,100.0%,0.16666666666666669,0.0,"Provide open space for cross cultural networks to cultivate through beneficial ecosystem practices, partnership, craft and research."
136,240,100.0%,0.16666666666666669,0.0,E
136,240,100.0%,0.16666666666666669,0.0,The Land Bank partners and collaborates with other organizations to maximize conservation outcomes and meet community member needs.
136,240,100.0%,0.16666666666666669,0.0,I would like to attend land bank meetings 2x per year
136,240,100.0%,0.16666666666666669,0.0,"Protecting & restoring the Watershed, wetland forests, shorelines, nearshore, and Eastsound Swale - all in Eastsound UGA - is crucial!"
136,240,100.0%,0.16666666666666669,0.0,ho;dfghjyiop
136,240,100.0%,0.16666666666666669,0.0,I believe that land purchased with tax payer dollars should be accessible to the public. Perhaps limited access but at least some access.
136,240,100.0%,0.16666666666666669,0.0,The Land bank should operate operate in accordance to Washington State land use laws.
136,240,100.0%,0.16666666666666669,0.0,True
136,240,100.0%,0.16666666666666669,0.0,The questions related to ag land seem skewed toward making respondents oppose the preservation or leasing of ag land.
136,240,100.0%,0.16666666666666669,0.0,I own property in the islands
136,240,100.0%,0.16666666666666669,0.0,clear and concise.
136,240,100.0%,0.16666666666666669,0.0,Don't have one.
136,240,100.0%,0.16666666666666669,0.0,I support the Land Bank applying for carbon credits on its forest lands.
136,240,100.0%,0.16666666666666669,0.0,The Land Bank should focus limited resources for enviro restoration on natural areas not farms
136,240,100.0%,0.16666666666666669,0.0,"The San Juan Islands, including Land Bank Holdings, are at increasing risk of wildfire hazard."
136,240,100.0%,0.16666666666666669,0.0,FB should lease more land for islanders to grow local food
136,240,100.0%,0.16666666666666669,0.0,My family are resident on Orcas Island and through them I appreciate and share concerns for the future of the islands.
136,240,100.0%,0.16666666666666669,0.0,Humans that shop at Costco are the leading cause of Climate Change... not local farms.
136,240,100.0%,0.16666666666666669,0.0,Land Bank should restore farmland for local food production.
136,240,100.0%,0.16666666666666669,0.0,I drive a tesla
136,240,100.0%,0.16666666666666669,0.0,I work at the land bank
136,240,100.0%,0.16666666666666669,0.0,Land Bank Commission needs more diversity.
136,240,100.0%,0.16666666666666669,0.0,New leadership of the Land Bank is essential to continued relevance.
136,240,100.0%,0.16666666666666669,0.0,The Land Bank should maintain agricultural water rights.
136,240,100.0%,0.16666666666666669,0.0,The land bank is poorly managed and lacks transparency.
136,240,100.0%,0.16666666666666669,0.0,The Land Bank should prioritize preservation of working farmland for local food production.
136,240,100.0%,0.16666666666666669,0.0,There is a lack of transparency in the Land Bank
136,240,100.0%,0.16666666666666669,0.0,Restrictive easements should never be placed Land Bank properties.
136,240,100.0%,0.16666666666666669,0.0,The Land Bank should have an open RFP process when it seeks to partner on acquisitions.
136,240,100.0%,0.16666666666666669,0.0,The Land Bank should not convert Agricultural lands to recreation.
136,240,100.0%,0.16666666666666669,0.0,The Land Bank Commission immediately requires more diverse representation.
136,240,100.0%,0.16666666666666669,0.0,Agriculture on Land Bank properties is a critical
136,240,100.0%,0.16666666666666669,0.0,"The Land Bank needs several organic, sustainable, or regenerative farmers on the Land Bank Commission"
136,240,100.0%,0.16666666666666669,0.0,The landbank should focus on open space and agricultural viability.
136,240,100.0%,0.16666666666666669,0.0,The Land Bank should do more to maintain agricultural viability of farmlands it acquires.
136,240,100.0%,0.16666666666666669,0.0,Preserving working farmland for food production is important for the resiliency of island communities
136,240,100.0%,0.16666666666666669,0.0,Eating local makes a difference
136,240,100.0%,0.16666666666666669,0.0,it's better to eat local and seasonal than to truck strawberries and lettuce from California
136,240,100.0%,0.16666666666666669,0.0,I can reduce my carbon footprint by purchasing island grown produce.
136,240,100.0%,0.16666666666666669,0.0,Land based education programs help connect  community members to the land and the environment the Landbank is designed to protect
136,240,100.0%,0.16666666666666669,0.0,The Land Bank needs a farmer on the Commission.
136,240,100.0%,0.16666666666666669,0.0,The Land Bank is crucial to acquiring and maintaining ecologically important land in the San Juans to prevent rampant overdevelopment.
136,240,100.0%,0.16666666666666669,0.0,Land Bank policies should be guided by principles limit climate change.
136,240,100.0%,0.16666666666666669,0.0,I have attended Land Bank educational events.
136,240,100.0%,0.16666666666666669,0.0,The Land Bank should include climate change mitigation in every acquisition determination.
136,240,100.0%,0.16666666666666669,0.0,Let's do more of these types of surveys
136,240,100.0%,0.16666666666666669,0.0,open space created by land bank purchases contributes to the eco-economics of San Juan County.
136,240,100.0%,0.16666666666666669,0.0,Knowing that some islands land is protected into perpetuity brings a smile to my face.
136,240,100.0%,0.16666666666666669,0.0,Part of the mission of the Land Bank has to do with Ag Lands which requires a whole different kind of care.
136,240,100.0%,0.16666666666666669,0.0,I pressed the wrong answer on some questions. I DO think the LB has conflict of interest and lack of disclosure in decisions
136,240,100.0%,0.16666666666666669,0.0,Farmland must be preserved.
136,240,100.0%,0.16666666666666669,0.0,The cost of maintaining a new property should be considered in all lane acquisition decisions
136,240,100.0%,0.16666666666666669,0.0,Random people should not weigh in on many statements in this poll. We don’t do road maintenance by committee- why natural resource mgt?
136,240,100.0%,0.16666666666666669,0.0,The Land Bank is a critical conservation partner in the islands.
136,240,100.0%,0.16666666666666669,0.0,LB employees should not be on or using Facebook or other social media during working hours.
136,240,100.0%,0.16666666666666669,0.0,Raising Land Bank fees AND making them permanent are TWO separate issues. I would split that question into two.
136,240,100.0%,0.16666666666666669,0.0,we need more land a bank properties to help provide for the ecological health of the islands.
136,240,100.0%,0.16666666666666669,0.0,i have sold property in San Juan County in the last 20 years
136,240,100.0%,0.16666666666666669,0.0,The Land Bank may have a role to play in the affordable housing crisis in the San Juans.
136,240,100.0%,0.16666666666666669,0.0,Population increase and growth/building  in limited land space and resources of San Juan Islands is a concern.
136,240,100.0%,0.16666666666666669,0.0,Retention of Cultural Resources in situ should be a priority for public lands.
136,240,100.0%,0.16666666666666669,0.0,Land Bank should explore possibility of cooperative projects with local tribes to protect important cultural sites
136,240,100.0%,0.16666666666666669,0.0,SJ Co should put more effort into protecting water resources. Land Bank should participate in this effort when it can
136,240,100.0%,0.16666666666666669,0.0,Make the LB Director position an elected position.
136,240,100.0%,0.16666666666666669,0.0,The Land Bank should apply best available science and best management practices to its stewardship of preserves.
136,240,100.0%,0.16666666666666669,0.0,"Landbank lands are county lands and should be for the benefit of the public, not for profit limited liability companies"
136,240,100.0%,0.16666666666666669,0.0,The Land Bank is a critical part of keeping the San Juan's from turning into another overdeveloped Bainbridge Island.
136,240,100.0%,0.16666666666666669,0.0,"Land Bank properties should restore, and not remove, water from the islands limited aquifers"
136,240,100.0%,0.16666666666666669,0.0,Land Bank should sell off money sink properties like Coffelt farm and other agricultural properties with high operating expenses
180,135,68.0%,0.16594516594516592,0.004101839347841047,The Land Bank does a poor job or serving or including those who are not traditional supporters of the the Land Bank mission.
181,94,44.3%,0.16482204861111113,0.021303894186128,A permanent rather than renewing tax would decrease Land Bank accountability.
182,58,77.8%,0.16127232142857145,0.04939262806981776,"Wildfire hazard reduction strategies such as canopy thinning, ground and ladder fuel reduction are appropriate on some Land Bank properties."
183,138,59.6%,0.15873015873015872,0.003336880683123035,The Land Bank should pay property tax on parcels they own that are NOT publicly accessible.
184,95,45.0%,0.15350029726516054,0.02113614467649807,Lesees of Land Bank land should not be present for community suggestion-making meetings regarding lease renewals as it silences some opinions.
185,91,47.6%,0.1526683300723402,0.022142159044925475,Allowing commercial farmers to lease Land Bank property creates an unfair subsidy that undermines the sustainability of the larger community of farmers.
186,128,58.6%,0.15100591715976325,0.006257005791382994,The Land Bank should encourage higher urban residential densities to reduce pressure on development of rural and undeveloped parcels.
187,92,49.3%,0.14948593073593072,0.022122187802353255,Land Bank is not effectively managing existing properties.
